URL,Title,Date
https://www.cbsnews.com/news/what-is-deepseek-ai-china-stock-nvidia-nvda-asml/,"What is DeepSeek, and why is it causing Nvidia and other stocks to slump? - CBS News",2025-01-28
https://www.aljazeera.com/economy/2025/1/28/why-chinas-ai-startup-deepseek-is-sending-shockwaves-through-global-tech,"What’s DeepSeek, China’s AI startup sending shockwaves through global tech?",2025-01-28
https://www.inc.com/joe-procopio/deepseek-is-the-wake-up-call-our-ai-overlords-needed/91140446,DeepSeek Is the Wake-Up Call Our AI Overlords Needed,2025-01-28
https://www.forrester.com/blogs/deepseek-just-opened-the-path-to-ai-roi/,DeepSeek Just “Opened” The Path To AI ROI,2025-01-28
https://www.cnbc.com/2025/01/28/us-navy-restricts-use-of-deepseek-ai-imperative-to-avoid-using.html,U.S. Navy bans use of DeepSeek AI: 'Imperative' to avoid using,2025-01-28
https://apnews.com/article/deepseek-ai-china-climate-fossil-fuels-00c594310b22afbf150559d08b43d3a5,DeepSeek says it built its chatbot cheap. What does that mean for AI's energy needs and the climate?,2025-01-28
https://www.nytimes.com/2025/01/28/business/deepseek-owner-china-ai.html,How DeepSeek Went From Stock Trader to A.I. Star - The New York Times,2025-01-28
https://www.atlanticcouncil.org/blogs/new-atlanticist/what-deepseeks-breakthrough-says-and-doesnt-say-about-the-ai-race-with-china/,What DeepSeek’s breakthrough says (and doesn’t say) about the ‘AI race’ with China - Atlantic Council,2025-01-28
https://edition.cnn.com/2025/01/28/business/deepseek-ai-nvidia-nightcap/index.html,DeepSeek just blew up the AI industry’s narrative that it needs more money and power,2025-01-28
https://www.forbes.com/sites/kolawolesamueladebayo/2025/01/28/the-biggest-winner-in-the-deepseek-disruption-story-is-open-source-ai/,The Biggest Winner In The DeepSeek Disruption Story Is Open Source AI,2025-01-28
https://thehackernews.com/2025/01/top-rated-chinese-ai-app-deepseek.html,Top-Rated Chinese AI App DeepSeek Limits Registrations Amid Cyberattacks,2025-01-28
https://fortune.com/2025/01/28/deepseek-ai-stock-market/,Why DeepSeek is excellent news for the U.S. stock market,2025-01-28
https://carnegieendowment.org/posts/2025/01/deepseek-ai-china-chips-explainer?lang=en,"Chips, China, and a Lot of Money: The Factors Driving the DeepSeek AI Turmoil",2025-01-28
https://www.voanews.com/a/truth-struggles-against-propaganda-and-censorship-on-china-s-deepseek-ai/7955109.html,Truth struggles against propaganda and censorship on China’s DeepSeek AI,2025-01-28
https://www.utilitydive.com/news/ipp-stocks-reel-as-low-cost-deepseek-chills-ai-load-growth-thesis/738482/,"Generator, advanced nuclear stocks reel as low-cost DeepSeek chills AI load growth outlook",2025-01-28
https://www.pcgamer.com/hardware/chatgpt-vs-deepseek-which-ai-can-build-me-a-better-gaming-pc/,ChatGPT vs DeepSeek: which AI can build me a better gaming PC?,2025-01-28
https://www.washingtonpost.com/technology/2025/01/27/what-is-deepseek-ai-china-us-stock-fears/,What is China’s DeepSeek AI and why is it worrying U.S. tech investors? - The Washington Post,2025-01-27
https://www.nytimes.com/2025/01/28/technology/china-deepseek-ai-silicon-valley.html,Why DeepSeek Could Change What Silicon Valley Believe About A.I. - The New York Times,2025-01-28
https://www.forbes.com/sites/stevemcdowell/2025/01/28/deepseek-unlocks-golden-opportunity-for-it-infrastructure-providers/,DeepSeek Unlocks Golden Opportunity For IT Infrastructure Providers,2025-01-28
https://foreignpolicy.com/2025/01/28/deepseek-ai-china-us-markets-trump/,China Brief: DeepSeek Doesn't Signal an AI Space Race,2025-01-28
https://www.reuters.com/technology/tech-stock-selloff-deepens-deepseek-triggers-ai-rethink-2025-01-28/,US tech shares recover some losses from steep DeepSeek selloff,2025-01-28
https://www.reuters.com/technology/artificial-intelligence/white-house-evaluates-china-ai-app-deepseeks-affect-national-security-official-2025-01-28/,White House evaluates effect of China AI app DeepSeek on national security,2025-01-28
https://apnews.com/article/deepseek-founder-liang-wenfeng-china-ai-0673d5c39d90108189cc31b88d85b9f8,"Who is Liang Wenfeng, DeepSeek's founder?",2025-01-28
https://www.theverge.com/ai-artificial-intelligence/598846/deepseek-big-tech-ai-industry-nvidia-impac,Why everyone is freaking out about DeepSeek,2025-01-28
https://www.wired.com/story/deepseek-executives-reaction-silicon-valley/,"DeepSeek’s New AI Model Sparks Shock, Awe, and Questions From US Competitors",2025-01-28
https://apnews.com/article/deepseek-chatgpt-openai-differences-artificial-intelligence-censorship-157e973a82547f7bf17cc659f2a03a2a,DeepSeek's new AI chatbot and ChatGPT answer sensitive questions about China differently,2025-01-28
https://www.axios.com/2025/01/28/deepseek-us-china-data-privacy-cyber-threats,DeepSeek's popularity raises concerns about securing U.S. data from China,2025-01-28
https://www.statista.com/chart/33839/prices-for-processing-one-million-input-output-tokens-on-different-ai-models/,Chart: DeepSeek-R1 Upsets AI Market With Low Prices,2025-01-28
https://time.com/7210569/deepseek-ai-trump/,"Future of DeepSeek, Like TikTok, May Come Down to Trump",2025-01-28
https://www.forbes.com/sites/emilsayegh/2025/01/28/deepseek-hype-vs-nvidia-and-apple-will-calmer-minds-prevail/,DeepSeek Hype Vs. Nvidia And Apple: Will Calmer Minds Prevail?,2025-01-28
https://www.semafor.com/article/01/28/2025/the-real-deepseek-revelation-the-market-doesnt-understand-ai,The real DeepSeek revelation: The market doesn’t understand AI,2025-01-28
https://www.computerweekly.com/news/366618446/DeepSeek-Welcome-to-US-artificial-intelligences-Sputnik-moment,DeepSeek: Welcome to US artificial intelligence’s Sputnik moment,2025-01-28
https://www.reuters.com/breakingviews/deepseek-offers-no-new-answers-chinas-ai-bind-2025-01-28/,DeepSeek offers no new answers to China’s AI bind,2025-01-28
https://www.axios.com/2025/01/28/deepseek-ai-national-security-trump,"White House ""looking into"" national security implications of DeepSeek's AI",2025-01-28
https://techinformed.com/deepseek-r1-sputnik-moment/,DeepSeek R1: Five key takeaways from GenAI’s “Sputnik moment”,2025-01-28
https://www.thefp.com/p/why-deepseek-is-a-gift-to-the-american,Why DeepSeek Is a Gift to the American People,2025-01-28
https://www.investors.com/news/technology/deepseek-ai-enterprise-software-sap-nvidia/,"DeepSeek AI Is 'Good News' For Enterprise Software, Says SAP CEODeepSeek AI Is 'Good News' For Enterprise Software, Says SAP CEO",2025-01-28
https://nymag.com/intelligencer/article/deepseek-r1-ai-panic-impact-commentary-analysis.html,7 Ways to Think About the DeepSeek AI Disruption,2025-01-28
https://www.forbes.com/sites/luisromero/2025/01/28/deepseek-now-in-perplexitys-ai-search-us-ai-dominance-challenged/,DeepSeek Now In Perplexity’s AI Search—U.S. AI Dominance Challenged,2025-01-28
https://www.reuters.com/technology/artificial-intelligence/italy-regulator-seeks-info-deepseek-data-protection-2025-01-28/,Italy regulator seeks information from DeepSeek on data protection,2025-01-28
https://www.axios.com/2025/01/28/altman-deepseek-r1-ai-models-openai,"Altman calls DeepSeek's R1 ""impressive"" and promises better models",2025-01-28
https://www.forbes.com/sites/hamiltonmann/2025/01/28/seek-deeper-on-deepseek-for-artificial-integrity-over-intelligence/,Seek Deeper On DeepSeek For Artificial Integrity Over Intelligence,2025-01-28
https://www.reuters.com/technology/deepseek-founder-liang-wenfeng-puts-focus-chinese-innovation-2025-01-28/,"Who is Liang Wenfeng, the founder of DeepSeek?",2025-01-28
https://fortune.com/2025/01/27/what-is-deepseek-ai-china-nvidia-openai-meta-stock-market/,What is China’s DeepSeek and why is it freaking out the AI world?,2025-01-27
https://azure.microsoft.com/en-us/blog/deepseek-r1-is-now-available-on-azure-ai-foundry-and-github/,DeepSeek R1 is now available on Azure AI Foundry and GitHub,2025-01-29
https://www.wiz.io/blog/wiz-research-uncovers-exposed-deepseek-database-leak,"Wiz Research Uncovers Exposed DeepSeek Database Leaking Sensitive Information, Including Chat History",2025-01-29
https://www.econlib.org/my-first-conversation-with-deepseek/,My First “Conversation” With DeepSeek - Econlib,2025-01-29
https://news.darden.virginia.edu/2025/01/29/qa-what-is-deepseek-the-bargain-ai-roiling-the-stock-market/,"Q&A: What Is DeepSeek, the Bargain AI Roiling the Stock Market? – Darden Report Online",2025-01-29
https://builtin.com/artificial-intelligence/deepseek-r1,What Is DeepSeek-R1?,2025-01-29
https://kpmg.com/us/en/media/news/insights-on-deepseek.html,DeepSeek: A breakthrough moment for AI,2025-01-29
https://arstechnica.com/ai/2025/01/how-does-deepseek-r1-really-fare-against-openais-best-reasoning-models/,How does DeepSeek R1 really fare against OpenAI’s best reasoning models? - Ars Technica,2025-01-29
https://www.nature.com/articles/d41586-025-00275-0,Scientists flock to DeepSeek: how they’re using the blockbuster AI model,2025-01-29
https://aws.amazon.com/cn/blogs/machine-learning/deploy-deepseek-r1-distilled-llama-models-with-amazon-bedrock-custom-model-import/,Deploy DeepSeek-R1 distilled Llama models with Amazon Bedrock Custom Model Import,2025-01-29
https://www.reuters.com/technology/deepseek-app-unavailable-apple-google-app-stores-italy-2025-01-29/,DeepSeek blocked on Apple and Google app stores in Italy,2025-01-29
https://edition.cnn.com/2025/01/29/tech/deepseek-silicon-valley-ai/index.html,Why DeepSeek could mark a turning point for Silicon Valley on AI,2025-01-29
https://www.eenews.net/articles/game-changer-what-deepseek-ai-means-for-electricity/,‘Game changer’? What ‘DeepSeek’ AI means for electricity. - E&E News by POLITICO,2025-01-29
https://medium.com/the-generator/why-deepseek-doesnt-matter-a6f70fa03512,"Why DeepSeek Doesn’t Matter. The new AI model is a hack, not an…",2025-01-29
https://news.rice.edu/news/2025/rise-deepseek-experts-weigh-disruptive-impact-new-chinese-open-source-ai-model,Rise of DeepSeek: Experts weigh in on the disruptive impact of new Chinese open-source AI model,2025-01-29
https://www.reuters.com/technology/irish-data-regulator-requests-information-deepseek-data-processing-2025-01-29/,Irish data regulator requests information from DeepSeek on data processing,2025-01-29
https://www.forrester.com/blogs/deepseek-unleashes-smaller-footprint-models-that-can-transform-aiops-from-cloud-to-edge/,DeepSeek Unleashes Smaller-Footprint Models That Can Transform AIOps From Cloud To Edge,2025-01-29
https://www.androidauthority.com/deepseek-vs-gemini-3521178/,"I tried out DeepSeek, but I’m sticking with Gemini for now - Android Authority",2025-01-29
https://www.reuters.com/technology/artificial-intelligence/deepseeks-global-success-received-by-chinese-with-pride-glee-2025-01-29/,DeepSeek's global success received by Chinese with pride and glee,2025-01-29
https://www.vox.com/technology/397330/deepseek-openai-chatgpt-gemini-nvidia-china,DeepSeek’s AI is bad for OpenAI and NVIDIA. But it might be great for you.,2025-01-29
https://www.forbes.com/sites/alexvakulov/2025/01/28/deepseek-cyberattack-exposes-ai-platform-risks-learn-how-to-stay-safe/,DeepSeek Cyberattack Exposes AI Platform Risks: 9 Tips To Stay Safe,2025-01-29
https://www.city-journal.org/article/china-deepseek-ai-energy-power,DeepSeek AI Energy Breakthrough Still Faces a Problem,2025-01-29
https://www.reuters.com/technology/artificial-intelligence/alibaba-releases-ai-model-it-claims-surpasses-deepseek-v3-2025-01-29/,Alibaba releases AI model it says surpasses DeepSeek,2025-01-29
https://www.forbes.com/sites/emilsayegh/2025/01/27/deepseek-the-chinese-ai-startup-reshaping-the-us-tech-industry/,DeepSeek: The Chinese AI Startup Reshaping The U.S. Tech Industry,2025-01-28
https://www.nytimes.com/2025/01/29/technology/openai-deepseek-data-harvest.html,OpenAI Says DeepSeek May Have Improperly Harvested Its Data - The New York Times,2025-01-29
https://time.com/7210888/deepseeks-hidden-ai-safety-warning/,DeepSeek’s Hidden Warning For AI Safety,2025-01-29
https://www.reuters.com/technology/artificial-intelligence/american-ai-firms-try-poke-holes-disruptive-deepseek-2025-01-28/,DeepSeek leaves US AI firms racing to understand its success,2025-01-29
https://www.reuters.com/technology/artificial-intelligence/microsoft-rolls-out-deepseeks-ai-model-azure-2025-01-29/,Microsoft rolls out DeepSeek's AI model on Azure,2025-01-29
https://www.defenseone.com/technology/2025/01/how-deepseek-changed-future-aiand-what-means-national-security/402594/,How DeepSeek changed the future of AI—and what that means for national security - Defense One,2025-01-29
https://apnews.com/article/china-ai-models-usa-technology-92d10dc20e3110b2774a5bc8f976e8f9,DeepSeek has rattled the AI industry. Here's a quick look at other Chinese AI models,2025-01-29
https://www.wsj.com/articles/how-a-free-software-strategy-catapulted-deepseek-to-ai-stardom-67e98349,How a Free Software Strategy Catapulted DeepSeek to AI Stardom - WSJ,2025-01-29
https://www.reuters.com/world/china/deepseeks-chatbot-achieves-17-accuracy-trails-western-rivals-newsguard-audit-2025-01-29/,"DeepSeek's chatbot achieves 17% accuracy, trails Western rivals in NewsGuard audit",2025-01-29
https://news.northeastern.edu/2025/01/28/deepseek-low-cost-ai-chatbot/,DeepSeek’s Low-Cost AI Chatbot is a Win for the Whole Industry,2025-01-28
https://foreignpolicy.com/2025/01/29/deepseek-china-ai-chatgpt-stocks/,DeepSeek Is Reshaping China’s AI Landscape – Foreign Policy,2025-01-29
https://www.brookings.edu/articles/deepseek-shows-the-limits-of-us-export-controls-on-ai-chips/,DeepSeek shows the limits of US export controls on AI chips,2025-01-29
https://www.reuters.com/technology/artificial-intelligence/high-flyer-ai-quant-fund-behind-chinas-deepseek-2025-01-29/,"High-Flyer, the AI quant fund behind China's DeepSeek",2025-01-29
https://www.nytimes.com/2025/01/29/business/deepseek-china-liang-wenfeng.html,"Who Is Liang Wenfeng, the Founder of the A.I. Start-Up DeepSeek? - The New York Times",2025-01-29
https://www.christianitytoday.com/2025/01/deepseek-china-church-ai-censorship-sensitive/,What DeepSeek Says about the Church in China - Christianity Today,2025-01-29
https://www.reuters.com/technology/artificial-intelligence/why-blocking-chinas-deepseek-using-us-ai-may-be-difficult-2025-01-29/,Why blocking China's DeepSeek from using US AI may be difficult,2025-01-29
https://www.reuters.com/technology/australia-urges-citizens-be-cautious-about-using-china-ai-model-deepseek-2025-01-29/,Australia urges citizens to be cautious about using China AI model DeepSeek,2025-01-29
https://www.wsj.com/articles/u-s-businesses-already-love-deepseek-1679cde2,U.S. Businesses Already Love DeepSeek - WSJ,2025-01-29
https://www.axios.com/2025/01/29/openai-deepseek-ai-models-data-training,"OpenAI says DeepSeek may have ""inappropriately"" used its models' output",2025-01-29
https://apnews.com/article/deepseek-ai-chatgpt-openai-copyright-a94168f3b8caa51623ce1b75b5ffcc51,Did DeepSeek copy ChatGPT to make new AI chatbot? Trump adviser thinks so,2025-01-29
https://www.reuters.com/technology/nvidia-shares-jump-rebounding-after-deepseek-linked-drop-2025-01-29/,"Chip stocks mixed with DeepSeek shock, earnings in focus",2025-01-29
https://www.forbes.com/sites/bernardmarr/2025/01/29/how-chinas-deepseek-redefined-the-global-ai-race/,How China's DeepSeek Redefined The Global AI Race,2025-01-29
https://www.economist.com/leaders/2025/01/29/the-real-meaning-of-the-deepseek-drama,The real meaning of the DeepSeek drama,2025-01-29
https://www.bloomberg.com/news/newsletters/2025-01-28/deepseek-scrambles-the-ai-and-emissions-equation-green-daily,DeepSeek Scrambles the AI and Emissions Equation: Green Daily - Bloomberg,2025-01-28
https://time.com/7210875/deepseek-national-security-threat-tiktok/,Why DeepSeek is Sparking TikTok-Like National Security Fears,2025-01-29
https://www.cbsnews.com/news/deepseek-ai-raises-national-security-concerns-trump/,"DeepSeek AI raises national security concerns, U.S. officials say - CBS News",2025-01-29
https://venturebeat.com/ai/dario-amodei-challenges-deepseeks-6-million-ai-narrative-what-anthropic-thinks-about-chinas-latest-ai-move/,Dario Amodei challenges DeepSeek’s $6 million AI narrative: What Anthropic thinks about China’s latest AI move,2025-01-29
https://www.reuters.com/technology/asml-ceo-makes-case-that-deepseek-is-positive-chip-demand-2025-01-29/,ASML CEO makes case that DeepSeek is positive for chip demand,2025-01-29
https://www.wired.com/story/exposed-deepseek-database-revealed-chat-prompts-and-internal-data/,Exposed DeepSeek Database Revealed Chat Prompts and Internal Data,2025-01-29
https://www.tomsguide.com/news/live/deepseek-live-updates-ai-news,"DeepSeek live updates — OpenAI cries foul, Nvidia impact and latest news",2025-01-29
https://www.reuters.com/technology/artificial-intelligence/sensitive-deepseek-data-exposed-web-israeli-cyber-firm-says-2025-01-29/,"Sensitive DeepSeek data exposed to web, cyber firm says",2025-01-29
https://www.datacenterdynamics.com/en/news/openai-claims-deepseek-used-its-model-to-train-cheaper-alternative/,OpenAI claims DeepSeek used its model to train cheaper alternative - DCD,2025-01-29
https://www.nature.com/articles/d41586-025-00259-0,How China created AI model DeepSeek and shocked the world,2025-01-30
https://aws.amazon.com/cn/blogs/aws/deepseek-r1-models-now-available-on-aws/,DeepSeek-R1 models now available on AWS,2025-01-30
https://cyberscoop.com/deepseek-ai-security-issues-wiz-research/,Wiz researchers find sensitive DeepSeek data exposed to internet,2025-01-30
https://blogs.nvidia.com/blog/deepseek-r1-nim-microservice/,DeepSeek-R1 Now Live With NVIDIA NIM,2025-01-30
https://www.windowscentral.com/software-apps/i-asked-deepseek-and-chatgpt-who-would-win-in-a-fight-one-of-them-had-the-funniest-answer,DeepSeek vs ChatGPT: who would win in a fight?,2025-01-30
https://www.bu.edu/articles/2025/does-chinas-deepseek-represent-a-new-frontier-in-ai/,Does China’s DeepSeek Represent a New—and Much Cheaper—Frontier in AI Technology?,2025-01-30
https://www.atlanticcouncil.org/blogs/econographics/sinographs/is-deepseek-a-proof-of-concept/,Is DeepSeek a proof of concept? - Atlantic Council,2025-01-29
https://aws.amazon.com/cn/blogs/machine-learning/deepseek-r1-model-now-available-in-amazon-bedrock-marketplace-and-amazon-sagemaker-jumpstart/,DeepSeek-R1 model now available in Amazon Bedrock Marketplace and Amazon SageMaker JumpStart,2025-01-30
https://www.reuters.com/technology/artificial-intelligence/italys-privacy-watchdog-blocks-chinese-ai-app-deepseek-2025-01-30/,Italy's regulator blocks Chinese AI app DeepSeek on data protection,2025-01-30
https://time.com/7211646/is-deepseek-panic-overblown/,Is the DeepSeek Panic Overblown?,2025-01-30
https://www.forbes.com/sites/davidchou/2025/01/30/deepseeks-security-risk-is-a-critical-reminder-for-healthcare-cios/,DeepSeek’s Security Risk Is A Critical Reminder For CIOs,2025-01-30
https://www.reuters.com/technology/artificial-intelligence/french-privacy-watchdog-quiz-deepseek-ai-data-protection-2025-01-30/,"French privacy watchdog to quiz DeepSeek on AI, data protection",2025-01-30
https://builtin.com/artificial-intelligence/what-deepseek-means-for-tech,What DeepSeek Means for Tech,2025-01-29
https://www.crn.com/news/ai/2025/aws-adds-deepseek-s-r1-ai-model-to-amazon-bedrock-sagemaker,"AWS Adds DeepSeek’s R1 AI Model To Amazon Bedrock, SageMaker",2025-01-30
https://www.tomsguide.com/ai/what-is-deepseek-everything-to-know,What is DeepSeek? — everything to know,2025-01-30
https://www.investors.com/news/technology/ai-stocks-deepseek-us-china-artificial-intelligence-competition-nvidia/,AI Stocks: How DeepSeek Changed Views On U.S.-China Artificial Intelligence Competition,2025-01-30
https://www.forbes.com/sites/geruiwang/2025/01/30/deepseek-redefines-ai-with-explainable-reasoning-and-open-innovation/,DeepSeek Has More To Offer Beyond Efficiency: Explainable AI,2025-01-30
https://the-cfo.io/2025/01/30/whats-the-big-deal-with-deepseek-ai/,What's the big deal with DeepSeek AI? - The CFO,2025-01-30
https://www.forbes.com/sites/gilpress/2025/01/30/deepseek-means-the-end-of-big-data-not-the-end-of-nvidia/,"DeepSeek Means The End Of Big Data, Not The End Of Nvidia",2025-01-30
https://hbr.org/2025/01/why-deepseek-shouldnt-have-been-a-surprise,Why DeepSeek Shouldn’t Have Been a Surprise,2025-01-30
https://time.com/7211610/deepseek-not-reason-big-tech-more-powerful/,DeepSeek Is Not a Reason for Big Tech to Be More Powerful,2025-01-30
https://thehackernews.com/2025/01/deepseek-ai-database-exposed-over-1.html,"DeepSeek AI Database Exposed: Over 1 Million Log Lines, Secret Keys Leaked",2025-01-30
https://mashable.com/article/deepseek-database-exposed,DeepSeek database with private data and chat logs was exposed to the internet,2025-01-30
https://money.usnews.com/investing/articles/what-deepseek-ai-means-for-tech-stocks,What DeepSeek's Technology Could Mean for Tech Stocks,2025-01-30
https://edition.cnn.com/2025/01/30/business/openai-deepseek-nightcap/index.html,OpenAI now wants to make DeepSeek look like the villain,2025-01-30
https://www.techrepublic.com/article/deepseek-wiz-research-database-leak/,DeepSeek Locked Down Public Database Access That Exposed Chat History,2025-01-30
https://www.reuters.com/technology/artificial-intelligence/chinese-state-linked-accounts-hyped-deepseek-ai-launch-ahead-us-stock-rout-2025-01-31/,"Chinese state-linked accounts hyped DeepSeek AI launch ahead of US stock rout, Graphika says",2025-01-30
https://www.wired.com/story/china-taught-ai-startups-a-lesson-automakers-learned-years-ago/,DeepSeek Has Taught AI Startups a Lesson Automakers Learned Years Ago,2025-01-30
https://www.forbes.com/sites/charliefink/2025/01/30/deepseek-freakout-skild-robotics-raises-500-million-eleven-labs-ai-250-million/,"Deepseek Freakout, Skild Robotics Raises $500 Million, Eleven Labs AI $250 Million",2025-01-30
https://www.csoonline.com/article/3813224/deepseek-leaks-one-million-sensitive-records-in-a-major-data-breach.html,DeepSeek leaks one million sensitive records in a major data breach,2025-01-30
https://apnews.com/article/italy-blocks-deepseek-chatbot-artificial-intelligence-dc7e87835ed7a125b5e46614ddbd80d0,Italy blocks access to the Chinese AI application DeepSeek to protect users' data,2025-01-30
https://www.dw.com/en/what-does-chinas-deepseek-mean-for-ais-energy-and-water-use/a-71459557,What does DeepSeek mean for AI's environmental impact? – DW – 01/30/2025,2025-01-30
https://fortune.com/2025/01/30/deepseek-success-apple-intelligence-ai-validation/,Experts say the surprising success of DeepSeek is a 'validation of Apple Intelligence',2025-01-30
https://www.economist.com/podcasts/2025/01/30/what-deepseek-means-for-the-ai-race,What DeepSeek means for the AI race,2025-01-30
https://www.reuters.com/technology/artificial-intelligence/microsoft-meta-ceos-defend-hefty-ai-spending-after-deepseek-stuns-tech-world-2025-01-30/,"Microsoft, Meta back big AI spending despite DeepSeek's low costs",2025-01-30
https://www.jpmorgan.com/insights/outlook/market-outlook/eye-on-the-market-deepseek,"Eye on the Market: DeepSeek, NVIDIA, OpenAI and the Futility of U.S. Chip Bans",2025-01-29
https://www.forbes.com/sites/johnwerner/2025/01/30/did-deepseek-copy-off-of-openai-and-what-is-distillation/,Did DeepSeek Copy Off Of OpenAI? And What Is Distillation?,2025-01-30
https://www.techtarget.com/searchenterpriseai/news/366618674/Microsoft-AWS-and-Cerebras-launch-DeepSeek-R1-model,"Microsoft, AWS and Cerebras launch DeepSeek-R1 model",2025-01-30
https://selectcommitteeontheccp.house.gov/media/press-releases/moolenaar-krishnamoorthi-call-tightening-export-controls-chips-critical-chinas,"Moolenaar, Krishnamoorthi Call For Tightening Export Controls on Chips Critical to China's AI Platform DeepSeek and Other Measures to Address its Risks to Americans’ Data and Security",2025-01-30
https://siliconangle.com/2025/01/29/openai-finds-deepseek-used-data-train-r1-reasoning-model/,OpenAI finds DeepSeek used its data to train R1 reasoning model - SiliconANGLE,2025-01-29
https://www.malwarebytes.com/blog/news/2025/01/the-deepseek-controversy-authorities-ask-where-the-data-comes-from-and-where-it-goes,The DeepSeek controversy: Authorities ask where does the data come from and how safe is it?,2025-01-30
https://www.psu.edu/news/research/story/qa-deepseek-ai-assistant-and-future-ai,Q&A: DeepSeek AI assistant and the future of AI,2025-01-31
https://www.platformer.news/deepseek-design-user-interface-chain-of-thought-ai/,DeepSeek is also a design story,2025-01-31
https://virtualizationreview.com/Articles/2025/01/30/Cloud-Giants-Offer-DeepSeek-AI-Restricted-by-Many-Orgs.aspx,"Cloud Giants Offer DeepSeek AI, Restricted by Many Orgs, to Devs -- Virtualization Review",2025-01-30
https://www.thenation.com/article/economy/china-deepseek-industrial-policy-ai/,Why DeepSeek’s Surprise Breakthrough Shouldn’t Have Come as a Surprise,2025-01-30
https://ionanalytics.com/insights/mergermarket/us-ipo-market-grapples-with-deepseek-turmoil/,US IPO market grapples with DeepSeek turmoil - ION Analytics,2025-01-30
https://www.reuters.com/technology/india-it-minister-praises-deepseeks-low-cost-ai-compares-it-with-own-investment-2025-01-30/,"India IT minister praises DeepSeek's low-cost AI, compares it with own investment approach",2025-01-30
https://www.securityweek.com/unprotected-deepseek-database-leaked-highly-sensitive-information/,"Unprotected DeepSeek Database Exposed Chats, Other Sensitive Information - SecurityWeek",2025-01-31
https://www.forbes.com/sites/garthfriesen/2025/01/29/deepseeks-ai-innovation-what-it-means-for-investors-and-big-tech/,What DeepSeek’s AI Innovation Means For Investors And Big Tech,2025-01-30
