URL,Title,Date
https://www.csoonline.com/article/3816397/hackers-impersonate-deepseek-to-distribute-malware.html,Hackers impersonate DeepSeek to distribute malware,2025-02-04
https://finance.yahoo.com/news/deepseek-ai-tops-app-downloads-141941732.html,"DeepSeek AI Tops App Downloads, Surpasses ChatGPT but Faces Global Scrutiny",2025-02-04
https://finance.yahoo.com/news/deepseek-trojan-horse-kevin-oleary-203017747.html,"DeepSeek A Trojan Horse? Kevin O'Leary Calls BS On DeepSeek's $6M Budget, Claims They Ripped Off 60k Nvidia Chips From The Black Market",2025-02-04
https://fortune.com/2025/02/04/deepseek-open-source-ai-cybersecurity/,DeepSeek has given open-source AI a big lift. But is it safe for companies to use?,2025-02-04
https://edition.cnn.com/2025/02/04/business/australia-deepseek-ban-security-concerns-intl/index.html,Australia bans DeepSeek on government devices over security concerns,2025-02-04
https://www.forbes.com/sites/jerryweissman/2025/02/04/deepseek-fear-loathing-and-learning/,"DeepSeek: Fear, Loathing, And Learning",2025-02-04
https://gizmodo.com/deepseek-gets-an-f-in-safety-from-researchers-2000558645,DeepSeek Gets an 'F' in Safety From Researchers,2025-02-04
https://mashable.com/article/josh-hawley-bill-deepseek-ai-crime-for-americans,Bill threatens to make using DeepSeek a crime for Americans,2025-02-04
https://theconversation.com/openai-says-deepseek-inappropriately-copied-chatgpt-but-its-facing-copyright-claims-too-248863,OpenAI says DeepSeek ‘inappropriately’ copied ChatGPT – but it’s facing copyright claims too,2025-02-04
https://www.tomsguide.com/computing/online-security/is-deepseek-safe-to-use,Is DeepSeek safe to use?,2025-02-04
https://www.theatlantic.com/international/archive/2025/02/deepseek-ai-china-tech/681553/,DeepSeek and the Truth About Chinese Tech - The Atlantic,2025-02-04
https://www.fool.com/investing/2025/02/04/deepseek-just-exposed-biggest-flaw-ai-revolution/,DeepSeek Just Exposed the Biggest Flaw of the Artificial Intelligence (AI) Revolution,2025-02-04
https://www.datacenterdynamics.com/en/news/us-and-chinese-cloud-providers-offer-access-to-deepseek-models/,US and Chinese cloud providers offer access to DeepSeek models - DCD,2025-02-04
https://www.forbes.com/sites/talpatalon/2025/02/03/openai-announces-deep-research-days-after-deepseeks-ai-earthquake/,OpenAI Announces Deep Research Days After DeepSeek’s AI Earthquake,2025-02-04
https://www.securityweek.com/developers-targeted-with-malware-disguised-as-deepseek-package/,Developers Targeted With Malware Disguised as DeepSeek Package - SecurityWeek,2025-02-04
https://www.allianzgi.com/en/insights/outlook-and-commentary/deepseek-r1,DeepSeek R1 – what just happened?,2025-02-04
https://www.entrepreneur.com/business-news/who-is-liang-wenfeng-the-founder-of-ai-disruptor-deepseek/486564,"Who Is Liang Wenfeng, the Founder of AI Disruptor DeepSeek?",2025-01-29
https://www.tomsguide.com/computing/online-security/deepseek-ai-banned-by-nasa-us-navy-and-more-over-privacy-concerns,"DeepSeek AI banned by NASA, US Navy, and more over privacy concerns",2025-02-04
https://www.bbc.com/news/articles/c8d95v0nr1yo,Australia bans DeepSeek on government devices over security risk,2025-02-04
https://www.tomsguide.com/ai/i-tested-deepseek-r1-vs-qwen-2-5-vs-chatgpt-o3-mini-with-7-prompts-heres-the-winner,I tested DeepSeek R1 vs Qwen 2.5 vs ChatGPT o3-mini with 7 prompts – here’s the winner,2025-02-05
https://www.tomsguide.com/computing/online-security/one-million-sensitive-records-exposed-in-mass-deepseek-data-leak,Massive DeepSeek data leak exposes sensitive info for over 1 million users — what you need to know,2025-02-04
https://fortune.com/2025/02/04/ibm-ceo-ai-deepseek-technology/,"IBM CEO: DeepSeek proved us right—AI is not about big, proprietary systems",2025-02-04
https://economictimes.indiatimes.com/news/international/global-trends/the-deepseek-ai-revolution-has-a-security-problem/articleshow/117937783.cms?from=mdr,The DeepSeek AI revolution has a security problem - The Economic Times,2025-02-05
https://lifehacker.com/tech/congress-might-ban-deepseek,Congress Might Ban DeepSeek,2025-02-04
https://www.bloomberg.com/news/articles/2025-02-04/australia-bans-deepseek-from-government-tech-on-security-concern,Australia Bans DeepSeek From Government Tech Over Security - Bloomberg,2025-02-04
https://blog.checkpoint.com/artificial-intelligence/cpr-finds-threat-actors-already-leveraging-deepseek-and-qwen-to-develop-malicious-content/,CPR Finds Threat Actors Already Leveraging DeepSeek and Qwen to Develop Malicious Content - Check Point Blog,2025-02-04
https://www.forbes.com/sites/digital-assets/2025/02/04/how-ai-agents-blockchain-and-deepseek-are-reshaping-business-in-2025/,"How AI Agents, Blockchain, And DeepSeek Are Reshaping Business In 2025",2025-02-04
https://news.gsu.edu/2025/02/04/how-deepseek-is-changing-the-a-i-landscape/,"How Deepseek is Changing the AI Landscape - Georgia State University News - Press Releases, Robinson College of Business -",2025-02-04
https://tech.co/news/deepseek-jail-fine-senate-bill,"No, Using DeepSeek Won't Land You in Jail... Yet",2025-02-04
https://techcrunch.com/2025/02/04/alphabet-praises-deepseek-but-its-massively-ramping-up-its-ai-spending/,"Alphabet praises DeepSeek, but it's massively ramping up its AI spending",2025-02-05
https://www.businessinsider.com/meta-cto-andrew-bosworth-deepseek-ai-prediction-email-2025-2,Meta CTO Says He Called the Whole DeepSeek Thing 6 Months Ago - Business Insider,2025-02-04
https://economictimes.indiatimes.com/tech/artificial-intelligence/us-deepseek-ban-texas-australia-italy-south-korea/articleshow/117936050.cms?from=mdr,DeepSeek ban in US: Texas first to take action - The Economic Times,2025-02-05
https://www.scmp.com/tech/big-tech/article/3297346/tech-war-chinas-chip-firms-embrace-deepseek-ai-self-sufficiency-drive,Tech war: China’s chip firms embrace DeepSeek in AI self-sufficiency drive,2025-02-04
https://economictimes.indiatimes.com/news/international/global-trends/chinas-deepseek-ban-begins-in-usand-it-started-in-elon-musks-new-home-state/articleshow/117936250.cms?from=mdr,China’s DeepSeek ban begins in US—And it started in Elon Musk’s new home state - The Economic Times,2025-02-05
https://www.bloomberg.com/opinion/articles/2025-02-04/tiktok-treatment-deepseek-s-breakthroughs-are-too-big-for-the-us-to-ban,TikTok Treatment: DeepSeek’s Breakthroughs Are Too Big for the US to Ban - Bloomberg,2025-02-04
https://www.reuters.com/markets/deepseek-trump-how-hedge-funds-navigated-turbulent-start-2025-2025-02-04/,DeepSeek and Trump: How hedge funds navigated a turbulent start to 2025,2025-02-04
https://theconversation.com/albanese-government-bans-deepseek-from-official-devices-on-security-grounds-249022,Albanese government bans DeepSeek from official devices on security grounds,2025-02-04
https://www.techradar.com/computing/artificial-intelligence/openais-deep-research-smashes-records-for-the-worlds-hardest-ai-exam-with-chatgpt-o3-mini-and-deepseek-left-in-its-wake,"OpenAI's Deep Research smashes records for the world's hardest AI exam, with ChatGPT o3-mini and DeepSeek left in its wake",2025-02-04
https://dailycampus.com/2025/02/04/the-evie-dence-dont-stress-about-deepseek/,The Evie-dence: Don’t stress about DeepSeek,2025-02-04
https://www.windowscentral.com/software-apps/deepseek-6-million-r1-cost-efficient-model-training-might-be-a-ruse,DeepSeek spent $1.6B and bought 50k NVIDIA GPUs for its AI,2025-02-04
https://sambanova.ai/blog/sambanova-cloud-tulu-3-405b-a-new-model-better-than-deepseek-v3,"On SambaNova Cloud, Tülu 3 405B, A New Model Better than DeepSeek V3",2025-02-04
https://www.trendforce.com/news/2025/02/05/news-deepseek-reportedly-reveals-huaweis-ascend-910c-reaches-60-of-nvidia-h100s-inference-power/,[News] DeepSeek Reportedly Reveals Huawei’s Ascend 910C Reaches 60% of NVIDIA H100’s Inference Power,2025-02-05
https://www.tomshardware.com/tech-industry/artificial-intelligence/deepseek-research-suggests-huaweis-ascend-910c-delivers-60-percent-nvidia-h100-inference-performance,DeepSeek research suggests Huawei's Ascend 910C delivers 60% of Nvidia H100 inference performance,2025-02-04
https://interestingengineering.com/culture/law-proposed-to-criminalize-deepseek,"US to criminalize DeepSeek download, up to 20 years prison, $100M fine",2025-02-03
https://www.csis.org/analysis/dual-disruption-and-constant-surprises-trump-20-and-deepseek,A Dual Disruption and the Constant of Surprises: Trump 2.0 and DeepSeek,2025-02-04
https://www.theguardian.com/technology/2025/feb/04/deepseek-banned-from-australian-government-devices-over-national-security-concerns,DeepSeek banned from Australian government devices amid national security concerns,2025-02-04
https://www.cfodive.com/news/deepseek-surge-hits-companies-posing-security-risks/739121/,"DeepSeek surge hits companies, posing security risks",2025-02-04
https://www.spglobal.com/ratings/en/research/articles/250204-ai-brief-deepseek-is-a-catalyst-for-innovation-101613055,AI Brief: DeepSeek Is A Catalyst For Innovation,2025-02-04
https://www.fool.com/investing/2025/02/04/deepseek-disrupts-big-tech-responds/,"DeepSeek Disrupts, Big Tech Responds",2025-02-04
https://www.justsecurity.org/107337/just-security-podcast-diving-deeper-into-deepseek/,The Just Security Podcast: Diving Deeper into DeepSeek,2025-02-04
https://techpoint.africa/2025/02/04/my-deepseek-ai-review/,"I used Deepseek AI instead of ChatGPT for one week, here is my review",2025-02-04
https://www.independent.co.uk/tech/deepseek-ai-us-ban-prison-b2692396.html,DeepSeek users could face million-dollar fine and prison time under new law,2025-02-04
https://www.bloomberg.com/opinion/articles/2025-02-05/deepseek-ai-revolution-has-a-security-problem,DeepSeek AI Revolution Has a Security Problem - Bloomberg,2025-02-05
https://www.govconwire.com/2025/02/booz-allen-horacio-rozanski-deepseek-tech-partnerships-national-security/,"Booz Allen’s Horacio Rozanski on DeepSeek, Tech Partnerships to Advance National Security - GovCon Wire",2025-02-04
https://asia.nikkei.com/Business/Technology/Artificial-intelligence/Google-CEO-says-DeepSeek-s-very-good-work-is-a-plus-for-AI-demand,Google CEO says DeepSeek's 'very good' work is a plus for AI demand - Nikkei Asia,2025-02-05
https://www.businesswire.com/news/home/20250204744295/en/COMPL-AI-Identifies-Critical-Compliance-Gaps-in-DeepSeek-Models-Under-the-EU-AI-Act,COMPL-AI Identifies Critical Compliance Gaps in DeepSeek Models Under the EU AI Act,2025-02-04
https://www.globenewswire.com/news-release/2025/02/04/3020351/0/en/VERSES-Genius-Outperforms-DeepSeek-R1-Model-in-Code-Breaking-Mastermind-Challenge.html,VERSES® Genius™ Outperforms DeepSeek R1 Model in,2025-02-04
https://www.forbes.com/sites/markminevich/2025/02/06/the-6-million-ai-bombshell-how-deepseek-shook-wall-street-and-ai-leadership/,The $6 Million AI Bombshell: How DeepSeek Shook Wall Street And AI Leadership,2025-02-06
https://seekingalpha.com/article/4754514-broadcom-stock-potentially-deepseeks-biggest-beneficiary-reiterate-buy,Broadcom: Potentially DeepSeek's Biggest Beneficiary - Reiterate Buy (NASDAQ:AVGO),2025-02-04
https://www.computerworld.com/article/3815603/deepseek-latest-news-and-insights.html,DeepSeek — Latest news and insights – Computerworld,2025-02-04
https://fortune.com/2025/02/04/deepseek-ai-lesson-technology-autonomous-vehicles/,May Mobility CEO: DeepSeek shows it's time to rethink the 'biggest budget wins' mentality,2025-02-04
https://www.woodmac.com/podcasts/the-energy-gang/what-does-deepseek-ai-mean-energy/,What does DeepSeek AI mean for energy?,2025-02-04
https://www.sia-partners.com/en/insights/publications/deepseek-industry-disruptor-or-trojan-horse,DeepSeek: Industry disruptor or trojan horse?,2025-02-04
https://www.wsj.com/tech/australia-bans-deepseek-from-government-devices-5c1534d0,Australia Bans DeepSeek From Government Devices - WSJ,2025-02-05
https://www.eetimes.com/deepseek-may-have-achieved-ai-on-a-budget-but-dont-forget-llm-security/,"DeepSeek May Have Achieved AI on a Budget, But Don’t Forget LLM Security - EE Times",2025-02-04
https://heatmap.news/energy/deepseek-ai-energy-demand,What DeepSeek Means for AI Energy Demand - Heatmap News,2025-02-04
https://www.latintimes.com/americans-face-decades-prison-downloading-deepseek-under-new-republican-bill-574575,Americans Face Decades in Prison for Downloading DeepSeek Under New Republican Bill,2025-02-04
https://www.gzeromedia.com/gzero-ai/is-deepseek-the-next-us-national-security-threat,Is DeepSeek the next US national security threat? - GZERO Media,2025-02-04
https://www.investors.com/news/technology/amazon-stock-q4-earnings-2024-deepseek-tariffs-trump/,"Amazon Stock Q4 Earnings On Deck. AWS, DeepSeek, Tariffs In Focus.",2025-02-04
https://www.voanews.com/a/voa-mandarin-china-s-deepseek-replicates-advanced-us-ai-models-says-openai/7962105.html,"VOA Mandarin: China’s DeepSeek replicates advanced US AI models, says OpenAI",2025-02-04
https://wellsvillesun.com/blog/2025/02/04/deepseek-ai-the-new-chinese-ai-and-why-americans-should-be-cautious/,DeepSeek AI: The New Chinese AI and Why Americans Should Be Cautious - THE WELLSVILLE SUN,2025-02-04
https://www.weforum.org/stories/2025/02/open-source-ai-innovation-deepseek/,What is open-source AI and how could DeepSeek change the industry?,2025-02-05
https://abcnews.go.com/US/deepseek-coding-capability-transfer-users-data-directly-chinese/story?id=118465451,DeepSeek coding has the capability to transfer users' data directly to the Chinese government - ABC News,2025-02-05
https://spacenews.com/what-deepseek-just-pulled-off-and-why-space-tech-should-worry/,What DeepSeek just pulled off — and why space tech should worry - SpaceNews,2025-02-05
https://www.reuters.com/technology/artificial-intelligence/south-koreas-industry-ministry-temporarily-bans-access-deepseek-security-2025-02-05/,"South Korean ministries block DeepSeek on security concerns, officials say",2025-02-06
https://www.marketwatch.com/story/why-deepseek-could-still-shake-up-stock-prices-466bc1bc,How DeepSeek could deliver another blow to the stock market - MarketWatch,2025-02-05
https://www.france24.com/en/live-news/20250206-south-korea-ministries-police-block-deepseek-access,"South Korea ministries, police block DeepSeek access",2025-02-06
https://restofworld.org/2025/china-ai-talent-deepseek-rise-us-dominance/,"China’s AI talent fueled DeepSeek’s rise, challenging U.S. dominance - Rest of World",2025-01-24
https://www.techradar.com/vpn/experts-warn-deepseek-is-11-times-more-dangerous-than-other-ai-chatbots,Experts warn DeepSeek is 11 times more dangerous than other AI chatbots,2025-02-05
https://www.scmp.com/tech/tech-trends/article/3297509/deepseek-attracts-chinas-young-jobseekers-ai-firm-ramps-recruitment,DeepSeek attracts China’s young jobseekers as AI firm ramps up recruitment,2025-02-06
https://www.capacitymedia.com/article/deepseek-safety-questions-arise-amid-australia-ban-eu-compliance-uncertainty,DeepSeek: Safety questions arise amid Australia ban & EU compliance uncertainty,2025-02-05
https://www.livenowfox.com/news/deepseek-ban-senate-bill,"Downloading DeepSeek could land you a 20-year prison sentence, $1M fine under proposed US bill",2025-02-05
https://www.reuters.com/technology/artificial-intelligence/after-deepseek-leap-forward-russias-sberbank-plans-joint-ai-research-with-china-2025-02-06/,"After DeepSeek leap forward, Russia's Sberbank plans joint AI research with China",2025-02-06
https://www.scmp.com/news/china/science/article/3297503/deepseeks-ai-breakthrough-biggest-shock-come-out-china-185-years,DeepSeek’s AI breakthrough ‘is biggest shock to come out of China in 185 years’,2025-02-05
https://www.theinformation.com/articles/will-deepseek-hurt-scale-ais-business-model,Will DeepSeek Hurt Scale AI’s Business Model? — The Information,2025-02-05
https://www.vice.com/en/article/us-senator-wants-americans-who-use-deepseek-thrown-in-prison/,US Senator Wants Americans Who Use DeepSeek Thrown in Prison,2025-02-05
https://ca.finance.yahoo.com/news/deepseek-users-could-face-million-104352160.html,DeepSeek users in US could face million-dollar fine and prison time under new law,2025-02-04
https://cyber.fsi.stanford.edu/gdpi/publication/taking-stock-deepseek-shock,Taking Stock of the DeepSeek Shock,2025-02-05
https://economictimes.indiatimes.com/news/international/global-trends/us-news-china-ai-deepseek-coding-capability-to-transfer-users-data-directly-to-the-chinese-government-using-deepseek-this-bombshell-report-claims-your-data-could-be-at-high-risk/articleshow/117954067.cms?from=mdr,deepseek china news: Using DeepSeek? This bombshell report claims your data could be at high risk - The Economic Times,2025-02-05
https://finance.yahoo.com/news/arm-monster-valuation-put-test-130147603.html,Arm’s ‘Monster’ Valuation Put to Test as DeepSeek Angst Lingers,2025-02-05
https://www.windowscentral.com/software-apps/openai-deep-research-blows-chatgpt-o3-mini-and-deepseek-out-of-the-water,OpenAI's Deep Research beats DeepSeek in the hardest AI exam,2025-02-05
https://www.marketplace.org/2025/02/05/what-you-should-know-about-the-chinese-start-up-deepseek/,What you should know about the Chinese start-up DeepSeek  - Marketplace,2025-02-06
https://economictimes.indiatimes.com/news/international/us/if-you-download-deepseek-in-the-u-s-you-could-face-20-years-in-prison-and-a-100-million-fine-this-is-what-a-new-bill-introduced-in-the-senate-proposes-to-do/articleshow/117954136.cms?from=mdr,"DeepSeek: If you download DeepSeek in the U.S., you could face 20 years in prison and a $100 million fine; this is what a new bill introduced in the Senate proposes to do - The Economic Times",2025-02-05
https://www.scmp.com/week-asia/politics/article/3297548/south-korea-blocks-chinese-ai-deepseek-government-computers,South Korea blocks Chinese AI DeepSeek from government computers,2025-02-06
https://cointelegraph.com/news/us-senator-josh-hawley-bill-deepseek-ai,US senator introduces bill that could criminalize downloading DeepSeek AI,2025-02-05
https://www.tomshardware.com/tech-industry/artificial-intelligence/moore-threads-gpus-allegedly-show-excellent-inference-performance-with-deepseek-models,Moore Threads GPUs allegedly show 'excellent' inference performance with DeepSeek models,2025-02-05
https://economictimes.indiatimes.com/news/international/us/explosive-claim-deepseek-the-new-ai-tool-that-took-the-world-by-storm-has-hidden-code-that-can-send-user-data-directly-to-the-chinese-government-say-experts/articleshow/117960872.cms?from=mdr,"deepseek controversy: Explosive claim! DeepSeek, the new AI tool that took the world by storm, has hidden code that can send user data directly to the Chinese government, say experts - The Economic Times",2025-02-05
https://news.stthomas.edu/in-the-news-manjeet-rege-on-the-controversy-with-deepseeks-open-source-ai-model/,In the News: Manjeet Rege on the Controversy With DeepSeek’s Open Source AI Model - Newsroom,2025-02-05
https://247wallst.com/investing/2025/02/05/how-to-invest-in-deepseek-stock/,How to Buy in DeepSeek Stock - 24/7 Wall St.,2025-02-05
https://www.ndtv.com/feature/from-italy-to-taiwan-countries-that-have-banned-the-use-of-chinas-deepseek-7646528,"From Italy To Taiwan, Countries That Have Banned The Use Of China's DeepSeek",2025-02-06
https://www.defensenews.com/opinion/2025/02/05/preventing-chinas-deepseek-in-space/,Preventing China’s DeepSeek in Space,2025-02-05
https://idahonews.com/news/nation-world/chinas-deepseek-ai-could-expose-users-personal-data-artificial-intelligence-cloud-privacy-united-states,China's DeepSeek AI could expose users' personal data,2025-02-05
https://finance.yahoo.com/news/nvidia-stock-pops-as-big-tech-spending-boom-cools-deepseek-fears-180047216.html,Nvidia stock pops as Big Tech spending boom cools DeepSeek fears,2025-02-05
https://www.newscientist.com/article/mg26535293-300-deepseek-has-burst-the-ai-hype-bubble-now-all-bets-are-off/,DeepSeek has burst the AI hype bubble – now all bets are off,2025-02-05
https://www.independent.co.uk/tech/deepseek-ban-map-countries-ai-china-b2691924.html,Where in the world is DeepSeek banned and why?,2025-02-05
https://www.semafor.com/article/02/05/2025/deepseek-hallucinates-more-than-other-ai-models,DeepSeek hallucinates more than other AI models,2025-02-05
https://news.crunchbase.com/venture/ai-healthcare-deepseek-january-2025-funding-recap/,DeepSeek Shakes Up AI Landscape But US Still Dominated Venture Funding In January,2025-02-05
https://www.scmp.com/tech/big-tech/article/3297435/alibabas-updated-qwen-ai-model-overtakes-deepseeks-v3-chatbot-ranking,Alibaba’s updated Qwen AI model overtakes DeepSeek’s V3 in chatbot ranking,2025-02-05
https://economictimes.indiatimes.com/news/international/global-trends/here-is-the-list-of-countries-and-government-agencies-that-have-banned-deepseek-ai/articleshow/117953500.cms?from=mdr,Here is the list of countries and government agencies that have banned DeepSeek's AI - The Economic Times,2025-02-05
https://www.hindustantimes.com/world-news/which-countries-have-banned-deepseek-ai-the-chinese-answer-to-chatgpt-101738807121584.html,"Which countries have banned DeepSeek AI, the Chinese answer to ChatGPT?",2025-02-06
https://san.com/cc/deepseek-code-can-send-user-data-directly-to-chinese-government-report/,DeepSeek code can send user data directly to Chinese government: Report,2025-02-05
https://www.reuters.com/world/asia-pacific/south-korea-defence-ministry-blocks-access-deepseek-military-use-computers-2025-02-06/,"South Korea defence ministry blocks access to DeepSeek on military use computers, official says",2025-02-06
https://www.opb.org/article/2025/02/05/international-regulators-probe-how-deepseek-is-using-data-is-the-app-safe-to-use/,International regulators probe how DeepSeek is using data. Is the app safe to use? - OPB,2025-02-05
https://www.theguardian.com/science/audio/2025/feb/06/deepseek-weapons-and-climate-whats-on-the-table-at-the-paris-ai-summit-podcast,"DeepSeek, weapons and climate? What’s on the table at the Paris AI summit? – podcast",2025-02-06
https://www.thewirechina.com/2025/02/05/deepseeks-lesson-america-needs-smarter-export-controls/,DeepSeek's Lesson: America Needs Smarter Export Controls - The Wire China,2025-02-05
https://www.rfa.org/english/china/2025/02/06/china-australia-deep-seek-ban/,China calls Australia’s DeepSeek ban ‘politicization of technological issues’ – Radio Free Asia,2025-02-06
https://coreyspondence.substack.com/p/570-trauma-reads-the-deepseek-crash?utm_campaign=post&utm_medium=web,"570: trauma reads, the Deepseek crash, and meme linguistics",2025-02-05
https://www.prnewswire.com/news-releases/lightnings-new-ai-hub-makes-deepseek-r1-available-for-secure-deployment-on-private-enterprise-clouds-302368890.html,Lightning's New AI Hub Makes DeepSeek R1 available for Secure Deployment on Private Enterprise Clouds,2025-02-05
https://timesofindia.indiatimes.com/technology/tech-news/deepseek-source-code-can-send-data-to-chinese-company-that-america-banned-in-2019-called-more-dangerous-than-tiktok/articleshow/117958865.cms,DeepSeek source code can send data to Chinese company that America banned in 2019; called more dangerous than Tiktok - The Times of India,2025-02-05
https://www.france24.com/en/asia-pacific/20250206-south-korea-china-deepseek-military,South Korea ministries block access to China's DeepSeek from military devices,2025-02-06
https://www.scmp.com/news/people-culture/china-personalities/article/3297424/china-netizens-use-deepseek-copy-barbara-hsus-style-farewell-letters-mourn-passing,Chinese netizens use DeepSeek to copy Barbie Hsu’s style in mourning letters,2025-02-05
https://subscriber.politicopro.com/article/2025/02/we-asked-deepseek-about-geopolitics-it-gave-us-beijing-talking-points-00202599,POLITICO Pro,2025-02-05
https://www.semafor.com/article/02/05/2025/australian-and-indian-government-employees-warned-against-deepseek-use,Australian and Indian government employees warned against DeepSeek use,2025-02-05
https://www.computerworld.com/article/3816605/ai-chatbot-war-breaks-out-with-deepseek-debut-and-the-winner-isyou.html,"AI chatbot war breaks out with DeepSeek debut, and the winner is…you – Computerworld",2025-02-05
https://dankennedy.net/tag/deepseek/,DeepSeek – Media Nation,2025-02-05
https://timesofindia.indiatimes.com/india/which-countries-have-banned-chinese-ai-deepseek-india-us-south-korea-taiwan-italy/articleshow/117965057.cms,List of countries who have banned DeepSeek in various capacities,2025-02-06
https://www.scmp.com/tech/big-tech/article/3297486/whats-next-deepseek-ai-start-stays-mum-amid-post-holiday-plaudits,What’s next for DeepSeek? AI start-up stays mum amid post-holiday plaudits,2025-02-05
https://www.jdsupra.com/legalnews/fcpa-compliance-report-deepseek-and-the-33320/,FCPA Compliance Report: DeepSeek and the Sputnik Moment,2025-02-05
https://finance.yahoo.com/news/google-introduces-class-cheap-ai-160258242.html,Google debuts new class of cheap AI models after DeepSeek raises cost questions,2025-02-05
https://www.koreaherald.com/article/10413772,"Korea's ministries, businesses block DeepSeek over security concerns - The Korea Herald",2025-02-06
https://www.wral.com/story/house-lawmakers-push-to-ban-ai-app-deepseek-from-us-government-devices/21846534/,House lawmakers push to ban AI app DeepSeek from US government devices,2025-02-05
https://www.marketwatch.com/video/ai-promise-or-peril/here-are-the-winners-and-losers-from-deepseek-breakthrough/BABD21DD-1CFE-4ED7-8AEC-F395C22D3820.html,Here are the winners and losers from DeepSeek's breakthrough - MarketWatch,2025-02-05
https://www.prnewswire.com/news-releases/blinded-by-deepseek-a-million-other-ai-models-tracked-by-liftr-insights-302368128.html,Blinded by DeepSeek; A Million Other AI Models tracked by Liftr Insights,2025-02-05
